===== Pothole Detection Demo Pipeline =====
Started: Thu Dec  4 02:46:17 PST 2025
Project root: /Users/soumyajaiswal/Desktop/Prathamesh Patil/pothole_dectector_02

/Users/soumyajaiswal/Desktop/Prathamesh Patil/pothole_dectector_02/.venv/bin/python
Python 3.9.6
GPU available: False
BASE_WEIGHT=yolov8n.pt (runs/detect not found)
Video file exists: datasets/samples/my_road_video.mp4
-rw-r--r--@ 1 soumyajaiswal  staff    12M Dec  4 00:28 datasets/samples/my_road_video.mp4
Video properties: 768x432 @ 25.00 FPS, 570 frames
Disk space OK: 129 available
-rw-r--r--@ 1 soumyajaiswal  staff  1996 Dec  4 01:57 configs/defaults.yaml
-rw-r--r--@ 1 soumyajaiswal  staff  20365 Dec  4 01:57 src/data_pipeline.py
[2025-12-04 02:49:34] INFO - Loading model from: yolov8n.pt
[2025-12-04 02:49:34] INFO - Model loaded successfully
[2025-12-04 02:49:34] INFO - Running inference on: datasets/samples/my_road_video.mp4
[2025-12-04 02:49:34] INFO - Video properties: 768x432 @ 25.00 FPS, 570 frames
Processing video:   0%|          | 0/570 [00:00<?, ?it/s][2025-12-04 02:49:34] INFO - First frame saved to: outputs/my_road_video_out_first_frame.jpg
Processing video:   1%|          | 3/570 [00:00<00:22, 25.39it/s]Processing video:   1%|          | 7/570 [00:00<00:17, 32.75it/s]Processing video:   2%|▏         | 11/570 [00:00<00:15, 35.19it/s]Processing video:   3%|▎         | 15/570 [00:00<00:15, 36.40it/s]Processing video:   3%|▎         | 19/570 [00:00<00:14, 36.81it/s]Processing video:   4%|▍         | 23/570 [00:00<00:14, 36.84it/s]Processing video:   5%|▍         | 27/570 [00:00<00:14, 37.14it/s]Processing video:   5%|▌         | 31/570 [00:00<00:14, 37.23it/s]Processing video:   6%|▌         | 35/570 [00:00<00:14, 36.72it/s]Processing video:   7%|▋         | 39/570 [00:01<00:14, 36.69it/s]Processing video:   8%|▊         | 43/570 [00:01<00:14, 36.25it/s]Processing video:   8%|▊         | 47/570 [00:01<00:14, 36.40it/s]Processing video:   9%|▉         | 51/570 [00:01<00:14, 36.26it/s]Processing video:  10%|▉         | 55/570 [00:01<00:14, 36.50it/s]Processing video:  10%|█         | 59/570 [00:01<00:13, 36.73it/s]Processing video:  11%|█         | 63/570 [00:01<00:13, 36.78it/s]Processing video:  12%|█▏        | 67/570 [00:01<00:13, 36.99it/s]Processing video:  12%|█▏        | 71/570 [00:01<00:13, 37.10it/s]Processing video:  13%|█▎        | 75/570 [00:02<00:13, 37.34it/s]Processing video:  14%|█▍        | 79/570 [00:02<00:13, 37.44it/s]Processing video:  15%|█▍        | 83/570 [00:02<00:13, 37.32it/s]Processing video:  15%|█▌        | 87/570 [00:02<00:12, 37.21it/s]Processing video:  16%|█▌        | 91/570 [00:02<00:12, 37.32it/s]Processing video:  17%|█▋        | 95/570 [00:02<00:12, 37.22it/s]Processing video:  17%|█▋        | 99/570 [00:02<00:12, 36.99it/s]Processing video:  18%|█▊        | 103/570 [00:02<00:12, 37.10it/s]Processing video:  19%|█▉        | 107/570 [00:02<00:12, 37.20it/s]Processing video:  19%|█▉        | 111/570 [00:03<00:12, 37.44it/s]Processing video:  20%|██        | 115/570 [00:03<00:12, 37.35it/s]Processing video:  21%|██        | 119/570 [00:03<00:12, 37.24it/s]Processing video:  22%|██▏       | 123/570 [00:03<00:12, 34.96it/s]Processing video:  22%|██▏       | 127/570 [00:03<00:13, 33.60it/s]Processing video:  23%|██▎       | 131/570 [00:03<00:12, 34.83it/s]Processing video:  24%|██▎       | 135/570 [00:03<00:12, 35.61it/s]Processing video:  24%|██▍       | 139/570 [00:03<00:11, 36.25it/s]Processing video:  25%|██▌       | 143/570 [00:03<00:11, 36.59it/s]Processing video:  26%|██▌       | 147/570 [00:04<00:11, 36.95it/s]Processing video:  26%|██▋       | 151/570 [00:04<00:11, 37.24it/s]Processing video:  27%|██▋       | 155/570 [00:04<00:11, 37.45it/s]Processing video:  28%|██▊       | 159/570 [00:04<00:10, 37.52it/s]Processing video:  29%|██▊       | 163/570 [00:04<00:10, 37.75it/s]Processing video:  29%|██▉       | 167/570 [00:04<00:10, 37.90it/s]Processing video:  30%|███       | 171/570 [00:04<00:10, 38.09it/s]Processing video:  31%|███       | 175/570 [00:04<00:10, 38.10it/s]Processing video:  31%|███▏      | 179/570 [00:04<00:10, 38.04it/s]Processing video:  32%|███▏      | 183/570 [00:04<00:10, 37.93it/s]Processing video:  33%|███▎      | 187/570 [00:05<00:10, 37.46it/s]Processing video:  34%|███▎      | 191/570 [00:05<00:10, 37.34it/s]Processing video:  34%|███▍      | 195/570 [00:05<00:10, 37.31it/s]Processing video:  35%|███▍      | 199/570 [00:05<00:09, 37.39it/s]Processing video:  36%|███▌      | 203/570 [00:05<00:09, 37.37it/s]Processing video:  36%|███▋      | 207/570 [00:05<00:09, 37.43it/s]Processing video:  37%|███▋      | 211/570 [00:05<00:09, 37.53it/s]Processing video:  38%|███▊      | 215/570 [00:05<00:09, 37.49it/s]Processing video:  38%|███▊      | 219/570 [00:05<00:09, 37.60it/s]Processing video:  39%|███▉      | 223/570 [00:06<00:09, 37.58it/s]Processing video:  40%|███▉      | 227/570 [00:06<00:09, 37.54it/s]Processing video:  41%|████      | 231/570 [00:06<00:09, 37.50it/s]Processing video:  41%|████      | 235/570 [00:06<00:08, 37.48it/s]Processing video:  42%|████▏     | 239/570 [00:06<00:08, 37.40it/s]Processing video:  43%|████▎     | 243/570 [00:06<00:08, 37.42it/s]Processing video:  43%|████▎     | 247/570 [00:06<00:08, 37.25it/s]Processing video:  44%|████▍     | 251/570 [00:06<00:08, 37.26it/s]Processing video:  45%|████▍     | 255/570 [00:06<00:08, 37.34it/s]Processing video:  45%|████▌     | 259/570 [00:07<00:08, 37.42it/s]Processing video:  46%|████▌     | 263/570 [00:07<00:08, 37.45it/s]Processing video:  47%|████▋     | 267/570 [00:07<00:08, 37.47it/s]Processing video:  48%|████▊     | 271/570 [00:07<00:07, 37.47it/s]Processing video:  48%|████▊     | 275/570 [00:07<00:07, 37.31it/s]Processing video:  49%|████▉     | 279/570 [00:07<00:07, 37.32it/s]Processing video:  50%|████▉     | 283/570 [00:07<00:07, 37.16it/s]Processing video:  50%|█████     | 287/570 [00:07<00:07, 37.08it/s]Processing video:  51%|█████     | 291/570 [00:07<00:07, 37.23it/s]Processing video:  52%|█████▏    | 295/570 [00:07<00:07, 37.23it/s]Processing video:  52%|█████▏    | 299/570 [00:08<00:07, 37.34it/s]Processing video:  53%|█████▎    | 303/570 [00:08<00:07, 37.18it/s]Processing video:  54%|█████▍    | 307/570 [00:08<00:06, 37.71it/s]Processing video:  55%|█████▍    | 311/570 [00:08<00:06, 38.08it/s]Processing video:  55%|█████▌    | 315/570 [00:08<00:06, 38.11it/s]Processing video:  56%|█████▌    | 319/570 [00:08<00:06, 38.19it/s]Processing video:  57%|█████▋    | 323/570 [00:08<00:06, 38.21it/s]Processing video:  57%|█████▋    | 327/570 [00:08<00:06, 38.51it/s]Processing video:  58%|█████▊    | 331/570 [00:08<00:06, 38.62it/s]Processing video:  59%|█████▉    | 335/570 [00:09<00:06, 38.55it/s]Processing video:  59%|█████▉    | 339/570 [00:09<00:05, 38.68it/s]Processing video:  60%|██████    | 343/570 [00:09<00:05, 38.73it/s]Processing video:  61%|██████    | 347/570 [00:09<00:05, 38.66it/s]Processing video:  62%|██████▏   | 351/570 [00:09<00:05, 38.65it/s]Processing video:  62%|██████▏   | 355/570 [00:09<00:05, 38.63it/s]Processing video:  63%|██████▎   | 359/570 [00:09<00:05, 38.66it/s]Processing video:  64%|██████▎   | 363/570 [00:09<00:05, 38.56it/s]Processing video:  64%|██████▍   | 367/570 [00:09<00:05, 38.61it/s]Processing video:  65%|██████▌   | 371/570 [00:09<00:05, 38.53it/s]Processing video:  66%|██████▌   | 375/570 [00:10<00:05, 38.32it/s]Processing video:  66%|██████▋   | 379/570 [00:10<00:04, 38.25it/s]Processing video:  67%|██████▋   | 383/570 [00:10<00:04, 38.32it/s]Processing video:  68%|██████▊   | 387/570 [00:10<00:04, 38.52it/s]Processing video:  69%|██████▊   | 391/570 [00:10<00:04, 38.60it/s]Processing video:  69%|██████▉   | 395/570 [00:10<00:04, 38.70it/s]Processing video:  70%|███████   | 399/570 [00:10<00:04, 38.60it/s]Processing video:  71%|███████   | 403/570 [00:10<00:04, 38.58it/s]Processing video:  71%|███████▏  | 407/570 [00:10<00:04, 38.63it/s]Processing video:  72%|███████▏  | 411/570 [00:10<00:04, 38.62it/s]Processing video:  73%|███████▎  | 415/570 [00:11<00:04, 38.57it/s]Processing video:  74%|███████▎  | 419/570 [00:11<00:03, 38.65it/s]Processing video:  74%|███████▍  | 423/570 [00:11<00:03, 38.54it/s]Processing video:  75%|███████▍  | 427/570 [00:11<00:03, 38.45it/s]Processing video:  76%|███████▌  | 431/570 [00:11<00:03, 37.04it/s]Processing video:  76%|███████▋  | 435/570 [00:11<00:03, 36.40it/s]Processing video:  77%|███████▋  | 439/570 [00:11<00:03, 36.99it/s]Processing video:  78%|███████▊  | 443/570 [00:11<00:03, 37.37it/s]Processing video:  78%|███████▊  | 447/570 [00:11<00:03, 37.65it/s]Processing video:  79%|███████▉  | 451/570 [00:12<00:03, 37.89it/s]Processing video:  80%|███████▉  | 455/570 [00:12<00:03, 35.65it/s]Processing video:  81%|████████  | 459/570 [00:12<00:03, 36.54it/s]Processing video:  81%|████████  | 463/570 [00:12<00:02, 37.13it/s]Processing video:  82%|████████▏ | 467/570 [00:12<00:02, 37.43it/s]Processing video:  83%|████████▎ | 471/570 [00:12<00:02, 37.55it/s]Processing video:  83%|████████▎ | 475/570 [00:12<00:02, 37.69it/s]Processing video:  84%|████████▍ | 479/570 [00:12<00:02, 37.83it/s]Processing video:  85%|████████▍ | 483/570 [00:12<00:02, 37.98it/s]Processing video:  85%|████████▌ | 487/570 [00:13<00:02, 38.24it/s]Processing video:  86%|████████▌ | 491/570 [00:13<00:02, 38.12it/s]Processing video:  87%|████████▋ | 495/570 [00:13<00:01, 38.03it/s]Processing video:  88%|████████▊ | 499/570 [00:13<00:01, 38.11it/s]Processing video:  88%|████████▊ | 503/570 [00:13<00:01, 37.59it/s]Processing video:  89%|████████▉ | 507/570 [00:13<00:01, 37.64it/s]Processing video:  90%|████████▉ | 511/570 [00:13<00:01, 37.75it/s]Processing video:  90%|█████████ | 515/570 [00:13<00:01, 37.64it/s]Processing video:  91%|█████████ | 519/570 [00:13<00:01, 37.66it/s]Processing video:  92%|█████████▏| 523/570 [00:13<00:01, 37.54it/s]Processing video:  92%|█████████▏| 527/570 [00:14<00:01, 37.51it/s]Processing video:  93%|█████████▎| 531/570 [00:14<00:01, 37.43it/s]Processing video:  94%|█████████▍| 535/570 [00:14<00:00, 37.32it/s]Processing video:  95%|█████████▍| 539/570 [00:14<00:00, 37.51it/s]Processing video:  95%|█████████▌| 543/570 [00:14<00:00, 37.61it/s]Processing video:  96%|█████████▌| 547/570 [00:14<00:00, 37.82it/s]Processing video:  97%|█████████▋| 551/570 [00:14<00:00, 37.89it/s]Processing video:  97%|█████████▋| 555/570 [00:14<00:00, 38.20it/s]Processing video:  98%|█████████▊| 559/570 [00:14<00:00, 38.42it/s]Processing video:  99%|█████████▉| 563/570 [00:15<00:00, 38.59it/s]Processing video:  99%|█████████▉| 567/570 [00:15<00:00, 38.51it/s]Processing video: 100%|██████████| 570/570 [00:15<00:00, 37.49it/s]
[2025-12-04 02:49:49] INFO - Output video saved to: outputs/my_road_video_out.mp4
[2025-12-04 02:49:49] INFO - Total unique objects tracked: 17
[2025-12-04 02:49:49] INFO - JSON report saved to: outputs/my_road_video_report.json
[2025-12-04 02:49:49] INFO - CSV summary saved to: outputs/my_road_video_summary.csv
[2025-12-04 02:49:49] INFO - 
==================================================
[2025-12-04 02:49:49] INFO - Demo inference completed!
[2025-12-04 02:49:49] INFO - ==================================================
[2025-12-04 02:49:49] INFO - 
Outputs saved to: outputs/
[2025-12-04 02:49:49] INFO -   - Annotated video: my_road_video_out.mp4
[2025-12-04 02:49:49] INFO -   - JSON report: my_road_video_report.json
[2025-12-04 02:49:49] INFO -   - CSV summary: my_road_video_summary.csv
[2025-12-04 02:49:49] INFO -   - First frame: my_road_video_first_frame.jpg
Total frames: 570
Total detections: 85
Unique objects tracked: 17
Avg detections per frame: 0.1491
Baseline quality: moderate
moderate
Canonical outputs created
Final report created
